<?xml version="1.0" encoding="UTF-8"?>

<!-- List of all mineral concentrations that can be mined. -->
<mineral-concentrations
	xmlns="http://mars-sim.sourceforge.net/minerals"
	xmlns:xsi="http://www.w3.org/2001/XMLSchema-instance"
	xsi:schemaLocation="http://mars-sim.sourceforge.net/minerals schema/minerals.xsd">

	<!-- Hematite is an iron ore. -->
	<!-- http://en.wikipedia.org/wiki/Hematite -->
	<!-- frequency - how common are the mineral concentrations? -->
	<!-- Valid values: "common", "uncommon", "rare", "very_rare" -->
	<mineral name="hematite" frequency="common">
		<locale-list>
			<!-- locale topographical regions the mineral is located. -->
			<!-- Valid values: "volcanic", "sedimentary", "crater" -->
			<locale name="volcanic" />
			<locale name="sedimentary" />
		</locale-list>
	</mineral>
	
	<!-- Magnetite is an iron ore with volcanic and metamorphic origins. -->
	<!-- http://en.wikipedia.org/wiki/Magnetite -->
	<mineral name="magnetite" frequency="rare">
		<locale-list>
			<locale name="volcanic" />
			<locale name="sedimentary" />
		</locale-list>
	</mineral>
	
	<!-- Magnesite is a magnesium carbonate with metamorphic origins. -->
	<!-- http://en.wikipedia.org/wiki/Magnesite -->
	<mineral name="magnesite" frequency="rare">
		<locale-list>
			<locale name="sedimentary" />
		</locale-list>
	</mineral>
	
	<!-- Olivine is a magnesium iron silicate found in meteorites. -->
 	<!-- http://en.wikipedia.org/wiki/Olivine -->
	<mineral name="olivine" frequency="uncommon">
		<locale-list>
			<locale name="crater" />
		</locale-list>
	</mineral>
	
	<!-- Goethite is an iron ore that has metamorphic origins. -->
	<!-- http://en.wikipedia.org/wiki/Goethite -->
	<mineral name="goethite" frequency="common">
		<locale-list>
			<locale name="sedimentary" />
		</locale-list>
	</mineral>
	
	<!-- Kamacite is an iron-nickel mineral found in meteorites. -->
	<!-- http://en.wikipedia.org/wiki/Kamacite -->
	<mineral name="kamacite" frequency="common">
		<locale-list>
			<locale name="crater" />
		</locale-list>
	</mineral>
	
	<!-- Taenite is an iron-nickel mineral found in meteorites. -->
	<!-- http://en.wikipedia.org/wiki/Taenite -->
	<mineral name="taenite" frequency="common">
		<locale-list>
			<locale name="crater" />
		</locale-list>
	</mineral>
	
	<!-- Chalcopyrite is a copper sulfide mineral. -->
	<!-- http://en.wikipedia.org/wiki/Chalcopyrite -->
	<mineral name="chalcopyrite" frequency="uncommon">
		<locale-list>
			<locale name="sedimentary" />
			<locale name="volcanic" />
		</locale-list>
	</mineral>
	
	<!-- Malachite is a copper carbonate mineral. -->
	<!-- http://en.wikipedia.org/wiki/Malachite -->
	<mineral name="malachite" frequency="uncommon">
		<locale-list>
			<locale name="sedimentary" />
			<locale name="volcanic" />
		</locale-list>
	</mineral>
	
	<!-- Sylvite is a salt concentration of potasium chloride. -->
	<!-- http://en.wikipedia.org/wiki/Sylvite -->
	<mineral name="sylvite" frequency="common">
		<locale-list>
			<locale name="sedimentary" />
		</locale-list>
	</mineral>
	
</mineral-concentrations>